{
  "$schema": "../pilot.schema.json",
  "schemaVersion": 1,
  "id": "hel-engelstein",
  "label": "Pilot 007 — Helenental / Engelstein — PRIVATE PHONE BETA",
  "releaseState": "assembly",
  "identity": { "region": "Helenental", "regionSlug": "helenental", "crag": "Engelstein", "cragSlug": "engelstein", "sector": "Engelstein", "canonicalCragId": null },
  "provenance": { "notionUrl": "https://app.notion.com/p/3c1214135351812bb249d8a8d1a99887", "dataPath": "database/api/v1/crags/helenental/engelstein.json", "confidence": "imported-unverified", "lastReviewed": "2026-08-26" },
  "summary": { "routeCount": 17, "gradeSystem": "UIAA", "gradeRange": null, "discipline": "sport" },
  "journey": {
    "posterSlot": "hero",
    "master": {
      "src": "/explore/pilots/hel-engelstein/media/engelstein-central-reveal-720.mp4",
      "poster": "/explore/pilots/hel-engelstein/media/engelstein-central-poster-720.jpg",
      "duration": 43.5,
      "bytes": 8473328,
      "sha256": "65EF9EC0AA9027675736AB218F3E6169E6644E076BAC6DE5360B4C17AF7A82F7",
      "alt": "Owner-approved phone preview rising from the bridge to reveal Engelstein with Helenental behind it",
      "objectPosition": "50% center",
      "keyframeIntervalSeconds": 0.5,
      "stations": { "region": 0, "rock": 0.333333, "sector": 0.666667, "topo": 1 },
      "note": "PRIVATE PHONE BETA — frames 14–100 from DJI_0275, re-encoded at the supplied 720×406 frame size with 0.5-second seek points. Station anchors divide the approved reveal evenly for interaction testing; they do not assert route geometry, access, rights, or public-release readiness."
    },
    "chapters": [
      { "id": "region-rock", "from": "Region", "to": "Rock", "asset": "scrubRegionRock", "duration": 14.5, "direction": "forward", "objectPosition": "50% center" },
      { "id": "rock-sector", "from": "Rock", "to": "Sector", "asset": "scrubRockSector", "duration": 14.5, "direction": "forward", "objectPosition": "50% center" },
      { "id": "sector-topo", "from": "Sector", "to": "Topo", "asset": "scrubSectorTopo", "duration": 14.5, "direction": "forward", "objectPosition": "50% center" }
    ]
  },
  "modules": {
    "locator": { "title": "Helenental Regional Locator", "mobileLabel": "Atlas", "description": "Engelstein is the owner-defined central point between the Jammerwandl and Steinbruch beta journeys.", "primarySlots": [] },
    "panorama": { "title": "Engelstein Context", "mobileLabel": "Context", "description": "The approved bridge-to-Engelstein reveal supplies the phone journey; a true panorama or 360 remains missing.", "primarySlots": ["panoramaPoster", "panorama360"] },
    "routes": { "title": "Engelstein Routes", "mobileLabel": "Routes", "description": "Seventeen imported route records remain separate from access, gear and geometry claims.", "primarySlots": ["hero"] },
    "wall": { "title": "Engelstein Wall Reveal", "mobileLabel": "Wall", "description": "The approved central reveal is available as a replaceable beta poster and journey; wall geometry remains unverified.", "primarySlots": ["hero", "spatial"] },
    "topo": { "title": "Engelstein Topo + 3D", "mobileLabel": "Topo", "description": "Topo and web-ready 3D remain missing; access, equipment and biosphere cautions stay visible blockers.", "primarySlots": ["topo", "model"] }
  },
  "assets": {
    "hero": { "kind": "image", "status": "review", "targetPath": "/explore/pilots/hel-engelstein/hero/hero-1280.webp", "src": null, "alt": "Engelstein and the Schwechat from the approved central phone-beta reveal", "note": "PRIVATE BETA POSTER — extracted from the approved DJI_0275 frames derivative; public rights and final crop remain gated.", "preview": { "adapter": "same-origin", "src": "/explore/pilots/hel-engelstein/media/engelstein-central-poster-720.jpg", "provenance": "Owner-approved DJI_0275 frames 14–100 decision sequence; poster extracted from the locally validated phone derivative.", "verifiedForPilot": false, "replaceable": true } },
    "spatial": { "kind": "image", "status": "missing", "targetPath": "/explore/pilots/hel-engelstein/wall/spatial-1280.webp", "src": null, "alt": "Engelstein spatial wall study" },
    "topo": { "kind": "image", "status": "missing", "targetPath": "/explore/pilots/hel-engelstein/topo/topo-1280.webp", "src": null, "alt": "Engelstein topo" },
    "model": { "kind": "model", "status": "missing", "targetPath": "/explore/pilots/hel-engelstein/model/model.glb", "src": null, "alt": "Engelstein 3D model", "note": "Project files are inventory evidence, not a browser-ready model." },
    "panoramaPoster": { "kind": "panorama", "status": "missing", "targetPath": "/explore/pilots/hel-engelstein/panorama/poster-1600.webp", "src": null, "alt": "Helenental panorama near Engelstein" },
    "panorama360": { "kind": "link", "status": "missing", "targetPath": "/explore/pilots/hel-engelstein/panorama/360-link.txt", "src": null, "alt": "Interactive 360 view of Engelstein" },
    "scrubRegionRock": { "kind": "video", "status": "missing", "targetPath": "/explore/pilots/hel-engelstein/scrub/region-rock.mp4", "src": null, "alt": "Optional standalone Engelstein Region-to-Rock derivative", "note": "The private phone beta uses the single approved master timeline instead of duplicate chapter files." },
    "scrubRockSector": { "kind": "video", "status": "missing", "targetPath": "/explore/pilots/hel-engelstein/scrub/rock-sector.mp4", "src": null, "alt": "Optional standalone Engelstein Rock-to-Sector derivative", "note": "The private phone beta uses the single approved master timeline instead of duplicate chapter files." },
    "scrubSectorTopo": { "kind": "video", "status": "missing", "targetPath": "/explore/pilots/hel-engelstein/scrub/sector-topo.mp4", "src": null, "alt": "Optional standalone Engelstein Sector-to-Topo derivative", "note": "The private phone beta uses the single approved master timeline instead of duplicate chapter files." }
  }
}
